7091,NSUH Sleep Studies Center,HOSP-EC,Hospital Extension Clinic,04/23/1997,100 Community Drive,,Great Neck,New York,11021,,,,29,Nassau,7,Metropolitan Area Regional Office - Long Island,North Shore University Hospital,541.0,2951001H,North Shore University Hospital Inc,300 Community Drive,,Manhasset,New York,11030,"Northwell Healthcare, Inc.",2000 Marcus Ave.,,New Hyde Park,New York,11042.0,Not for Profit Corporation,40.7859,-73.705101,"(40.7859, -73.705101)"
9005,CenterLight Healthcare Diagnostic and Treatment Center,DTC-EC,Diagnostic and Treatment Center Extension Clinic,01/23/2009,555 Albany Avenue,,Amityville,New York,11701,6318417300.0,,,51,Suffolk,7,Metropolitan Area Regional Office - Long Island,CenterLight Healthcare Diagnostic and Treatment Center,4520.0,7000245R,CenterLight Healthcare Diagnostic and Treatment Center,612 Allerton Avenue,,Bronx,New York,10467,,,,,New York,,Not for Profit Corporation,40.703938,-73.404915,"(40.703938, -73.404915)"
15028,McPeak's Adult Home,AH,Adult Home,07/17/1989,286 North Ocean Avenue,,Patchogue,New York,11772,6314750445.0,6314755534.0,www.mcpeaks.com#http://www.mcpeaks.com#,51,Suffolk,7,Metropolitan Area Regional Office - Long Island,,,700-F-051,"McPeak's Adult Home, Inc.",286 North Ocean Avenue,,Patchogue,New York,11772-2010,,,,,New York,,Business Corporation,40.773552,-73.015789,"(40.773552, -73.015789)"
15619,Universacare Inc,LHCSA,Licensed Home Care Services Agency,05/01/2023,285 Post Avenue,,Westbury,New York,11590,,,,29,Nassau,7,Metropolitan Area Regional Office - Long Island,,,1462L002,Universa Inc.,161-10 Jamaica Avenue,Suite 403,Jamaica,New York,11432,,,Suite 403,,New York,,Business Corporation,,,
14808,Plattduetsche Home Society,AH,Adult Home,04/06/1988,1150 Hempstead Turnpike,,Franklin Square,New York,11010,5163524252.0,5163528656.0,www.plattduetschehome.com#http://www.plattduetschehome.com#,29,Nassau,7,Metropolitan Area Regional Office - Long Island,,,400-E-028,"Plattduetsche Altenheim Gesellschaft Von Brooklyn Und Umgegend, Inc.",1150 Hempstead Turnpike,,Franklin Square,New York,11010-1535,,,,,New York,,Not for Profit Corporation,40.708419,-73.683483,"(40.708419, -73.683483)"
12949,Muriel'S Heart Inc.,LHCSA,Licensed Home Care Services Agency,07/25/2016,430 West Merrick Road,Suite 10,Valley Stream,New York,11580,3478481969.0,3478481968.0,,29,Nassau,7,Metropolitan Area Regional Office - Long Island,,,1544L001,Muriel'S Heart Inc.,430 West Merrick Road,Suite 10,Valley Stream,New York,11580,,,Suite 10,,New York,,Business Corporation,40.667639,-73.707,"(40.667639, -73.707)"
14814,Harbor House,AH,Adult Home,05/30/2003,150 South Street,,Oyster Bay,New York,11771,5166248400.0,5166242949.0,www.oysterbayseniorcampus.com#http://www.oysterbayseniorcampus.com#,29,Nassau,7,Metropolitan Area Regional Office - Long Island,,,400-F-305,"Oyster Bay Senior Residence, Inc.",150 South St,,Oyster Bay,New York,11771-2244,,,,,New York,,Business Corporation,40.870583,-73.531565,"(40.870583, -73.531565)"
5528,"NYU Langone Hospital-Long Island Dialysis, Medical, and Dental Center",HOSP-EC,Hospital Extension Clinic,10/31/1994,200 Old Country Road,,Mineola,New York,11501,5167479480.0,,,29,Nassau,7,Metropolitan Area Regional Office - Long Island,NYU Langone Hospitals,1463.0,7002053H,NYU Langone Hospitals,550 First Avenue,,New York,New York,10016,,,,,New York,,Not for Profit Corporation,40.739185,-73.638214,"(40.739185, -73.638214)"
15365,"Sunrise Med Plus, LLC",DTC,Diagnostic and Treatment Center,11/02/2022,733-737 Commack Road,,Brentwood,New York,11717,,,,51,Suffolk,7,Metropolitan Area Regional Office - Long Island,,,5154216R,"Sunrise Med Plus, LLC",733-737 Commack Road,,Brentwood,New York,11717,,,,,New York,,LLC,,,
558,Cold Spring Hills Center for Nursing and Rehabilitation,NH,Residential Health Care Facility - SNF,08/01/1979,378 Syosset-Woodbury Road,,Woodbury,New York,11797,5169213900.0,5166227870.0,,29,Nassau,7,Metropolitan Area Regional Office - Long Island,,,2952310N,"Cold Spring Acquisition, LLC",378 Syosset-Woodbury Road,,Woodbury,New York,11797,,,,,New York,,LLC,40.825569,-73.470085,"(40.825569, -73.470085)"
12568,"New York Health Care, Inc.",LHCSA,Licensed Home Care Services Agency,05/23/1997,243 Fulton Avenue,,Valley Stream,New York,11581,5164817500.0,5167216721.0,www.nyhc.com,29,Nassau,7,Metropolitan Area Regional Office - Long Island,,,0604L001,"New York Health Care, Inc.",162-04 Jamaica Avenue,Third Floor,Jamaica,New York,11432,,,Third Floor,,New York,,Business Corporation,40.671593,-73.708724,"(40.671593, -73.708724)"
3395,Parker Jewish Institute for Health Care & Rehabilitation,LTHHCP,Long Term Home Health Care Program,07/08/1985,271-11 76th Avenue,,New Hyde Park,New York,11040,5165861500.0,5165861696.0,,29,Nassau,7,Metropolitan Area Regional Office - Long Island,,,7003902L,Parker Jewish Institute for Health Care & Rehabilitation,271-11 76th Avenue,,New Hyde Park,New York,11040,,,,,New York,,Not for Profit Corporation,40.753942,-73.706231,"(40.753942, -73.706231)"
538,Garden Care Center,NH,Residential Health Care Facility - SNF,07/31/1999,135 Franklin Avenue,,Franklin Square,New York,11010,5167752100.0,5167750811.0,,29,Nassau,7,Metropolitan Area Regional Office - Long Island,,,2950316N,"Garden Care Center,Inc",135 Franklin Avenue,,Franklin Square,New York,11010,,,,,New York,,Business Corporation,40.704697,-73.677116,"(40.704697, -73.677116)"
7647,"Pro Health Ambulatory Surgery Center, Inc",DTC,Diagnostic and Treatment Center,10/09/1998,2800 Marcus Avenue,,Lake Success,New York,11042,5166227400.0,,,29,Nassau,7,Metropolitan Area Regional Office - Long Island,,,2963201R,"Pro Health Ambulatory Surgery Center, Inc",2800 Marcus Avenue,,Lake Success,New York,11042,,,,,New York,,Business Corporation,40.757343,-73.69194,"(40.757343, -73.69194)"
12966,Res Home Care,LHCSA,Licensed Home Care Services Agency,09/03/2009,1461 Lakeland Avenue,Suite 12,Bohemia,New York,11716,6317324794.0,6317320355.0,www.restbiservices.com,51,Suffolk,7,Metropolitan Area Regional Office - Long Island,,,1569L001,"Restbi Services, Inc.",1461 Lakeland Avenue,Suite 12,Bohemia,New York,11716,,,Suite 12,,New York,,Business Corporation,40.779824,-73.109254,"(40.779824, -73.109254)"
14840,The Bristal at Massapequa,EHP,Enriched Housing Program,08/04/2006,400 County Line Road,,Massapequa,New York,11758,5166910706.0,5166917204.0,,29,Nassau,7,Metropolitan Area Regional Office - Long Island,,,400-S-314,"EB CARE at Massapequa, LLC",400 County Line Road,,Massapequa,New York,11758-1760,,,,,New York,,LLC,40.6787,-73.4247,"(40.6787, -73.4247)"
6969,GSHC for Pediatric Specialty Care,HOSP-EC,Hospital Extension Clinic,06/14/2007,655 Deer Park Avenue,,Babylon,New York,11702,6313212100.0,,,51,Suffolk,7,Metropolitan Area Regional Office - Long Island,Good Samaritan Hospital Medical Center,925.0,5154001H,Good Samaritan Hospital Medical Center,1000 Montauk Highway,,West Islip,New York,11795,"Catholic Health System of Long Island, Inc.",1 Huntington Quadrangle,,Melville,New York,11747.0,Not for Profit Corporation,40.712856,-73.32132,"(40.712856, -73.32132)"
2954,"Nassau County Department of Mental Health, Chemical Dependency and Developmental Disability Services - Methadone Maintenance Clinic",DTC,Diagnostic and Treatment Center,02/22/1988,Bldg K 2201 Hempstead Turnpike,,East Meadow,New York,11554,5165725906.0,,,29,Nassau,7,Metropolitan Area Regional Office - Long Island,,,2951202R,Nassau County,240 Old Country Road,,Mineola,New York,11501,,,,,New York,,County,40.725353,-73.554321,"(40.725353, -73.554321)"
5695,Outpatient Behavioral Health Services,HOSP-EC,Hospital Extension Clinic,04/21/1995,100 Highlands Boulevard,,Port Jefferson,New York,11777,6314733877.0,6314733091.0,,51,Suffolk,7,Metropolitan Area Regional Office - Long Island,John T Mather Memorial Hospital of Port Jefferson New York Inc,895.0,5149000H,John T Mather of Port Jefferson NY Inc,North Country Road,,Port Jefferson,New York,11777,"Northwell Healthcare, Inc.",2000 Marcus Ave.,,New Hyde Park,New York,11042.0,Not for Profit Corporation,40.933846,-73.048096,"(40.933846, -73.048096)"
8628,Stony Brook Primary Care Center,HOSP-EC,Hospital Extension Clinic,08/15/2008,205 Belle Mead Road,,East Setauket,New York,11733,6314444500.0,,,51,Suffolk,7,Metropolitan Area Regional Office - Long Island,Stony Brook University Hospital,245.0,5151001H,State University of New York,178-50 Linden Blvd,,Jamaica,New York,11434,,,,,New York,,State,40.896851,-73.088776,"(40.896851, -73.088776)"
13656,Senicare Plus,LHCSA,Licensed Home Care Services Agency,10/04/2018,1225 Franklin Avenue,Suite 325,Garden City,New York,11530,5163425500.0,5163425501.0,,29,Nassau,7,Metropolitan Area Regional Office - Long Island,,,2694L001,"Li Home Care Services, Inc.",1225 Franklin Avenue,Suite 325,Garden City,New York,11530,,,Suite 325,,New York,,Business Corporation,40.733056,-73.636875,"(40.733056, -73.636875)"
12477,Helping Hands,LHCSA,Licensed Home Care Services Agency,05/17/1989,251 Post Ave,,Westbury,New York,11590,5164896810.0,6312613083.0,,29,Nassau,7,Metropolitan Area Regional Office - Long Island,,,0034L001,"Homemaking Services For Chronically Ill, Inc.",76 Broadway,,Greenlawn,New York,11740,,,,,New York,,Business Corporation,,,
10276,The Phillips Family Cancer Center,HOSP-EC,Hospital Extension Clinic,04/24/2019,740 County Road 39A,,Southampton,New York,11968,6316387400.0,,,51,Suffolk,7,Metropolitan Area Regional Office - Long Island,Stony Brook University Hospital,245.0,5151001H,State University of New York,178-50 Linden Blvd,,Jamaica,New York,11434,,,,,New York,,State,40.898556,-72.373734,"(40.898556, -72.373734)"
9185,South Shore Surgery Center,DTC,Diagnostic and Treatment Center,12/17/2010,53 Brentwood Road,,Bay Shore,New York,11706,6316475550.0,,,51,Suffolk,7,Metropolitan Area Regional Office - Long Island,,,5154210R,"South Shore Surgery Center, LLC",53 Brentwood Road,,Bay Shore,New York,11706,,,,,New York,,LLC,40.730263,-73.235695,"(40.730263, -73.235695)"
14846,Atria Cutter Mill,EHP,Enriched Housing Program,05/15/2017,96 Cutter Mill Road,,Great Neck,New York,11021,5168583023.0,5167738735.0,#https://www.atriaseniorliving.com/retirement-communities/atria-cutter-mill-grea,29,Nassau,7,Metropolitan Area Regional Office - Long Island,,,400-S-328,"ATR New York LH, Inc.",500 N. Hurstbourne Parkway,Suite 200,Louisville,New York,40222,,,Suite 200,,New York,,Business Corporation,40.783942,-73.732257,"(40.783942, -73.732257)"
13235,"Steps In Home Care, Inc.",LHCSA,Licensed Home Care Services Agency,01/29/2013,250 Fulton Ave,Suite 207,Hempstead,New York,11550,9146184200.0,9146184201.0,,51,Suffolk,7,Metropolitan Area Regional Office - Long Island,,,1996L001,"Steps In Home Care, Inc.",250 Fulton Ave,Suite 207,Hempstead,New York,11550,,,Suite 207,,New York,,Business Corporation,,,
13185,At Home Senior Care Of Long Island,LHCSA,Licensed Home Care Services Agency,07/05/2012,2079 Wantagh Avenue,,Wantangh,New York,11793,5169385225.0,5163933202.0,,29,Nassau,7,Metropolitan Area Regional Office - Long Island,,,1913L001,"A & B Enterprises Of Long Island, Inc.",2079 Wantagh Avenue,,Wantangh,New York,11793,,,,,New York,,Business Corporation,40.669789,-73.51045,"(40.669789, -73.51045)"
13699,Right At Home Eastern L.I.,LHCSA,Licensed Home Care Services Agency,11/08/2019,85 Echo Avenue,Suite 5,Miller Place,New York,11764,6315091409.0,6319825222.0,,51,Suffolk,7,Metropolitan Area Regional Office - Long Island,,,2728L001,Jjr Lifecare Inc.,85 Echo Avenue,Suite 5,Miller Place,New York,11764,,,Suite 5,,New York,,Business Corporation,40.94502,-72.997924,"(40.94502, -72.997924)"
9172,North Shore LIJ Imaging at Great South Bay,HOSP-EC,Hospital Extension Clinic,10/21/2010,620 Main Street,,Islip,New York,11751,6314397237.0,6314397290.0,,51,Suffolk,7,Metropolitan Area Regional Office - Long Island,North Shore University Hospital,541.0,2951001H,North Shore University Hospital Inc,300 Community Drive,,Manhasset,New York,11030,"Northwell Quality and Medical Affairs, Inc.",2000 Marcus Ave.,,New Hyde Park,New York,11042.0,Not for Profit Corporation,40.729557,-73.211349,"(40.729557, -73.211349)"
12522,"Selfhelp Community Services, Inc.",LHCSA,Licensed Home Care Services Agency,04/20/1989,498 Union Avenue,(Level C),Westbury,New York,11590,5165052571.0,5164811652.0,www.selfhelp.net,29,Nassau,7,Metropolitan Area Regional Office - Long Island,,,0308L001,"Selfhelp Community Services, Inc.",520 Eighth Avenue,,New York,New York,10018-6553,,,,,New York,,Not for Profit Corporation,40.756249,-73.580636,"(40.756249, -73.580636)"
9377,Northwell Health Multispecialty and Imaging Services at Glen Cove,HOSP-EC,Hospital Extension Clinic,05/16/2012,10 Medical Plaza,,Glen Cove,New York,11542,5166740500.0,5166747546.0,,29,Nassau,7,Metropolitan Area Regional Office - Long Island,Glen Cove Hospital,490.0,2901000H,Glen Cove Hospital,St Andrews Lane,,Glen Cove,New York,11542,"Northwell Healthcare, Inc.",2000 Marcus Ave.,,New Hyde Park,New York,11042.0,Not for Profit Corporation,40.874603,-73.623009,"(40.874603, -73.623009)"
9201,HSS Long Island Outpatient Center,HOSP-EC,Hospital Extension Clinic,02/28/2011,333 Earle Ovington Boulevard,,Uniondale,New York,11553,5162228881.0,5162226893.0,,29,Nassau,7,Metropolitan Area Regional Office - Long Island,Hospital for Special Surgery,1447.0,7002012H,NY Society for the Relief of The Ruptured & Crippled,535 East 70th St,,New York,New York,10021,,,,,New York,,Not for Profit Corporation,40.725254,-73.592873,"(40.725254, -73.592873)"
15060,Sachem Adult Home,AH,Adult Home,11/08/1978,1298 Coates Avenue,,Holbrook,New York,11741,6315884554.0,6315884578.0,,51,Suffolk,7,Metropolitan Area Regional Office - Long Island,,,700-F-935,Sachem Adult Home And Alp Llc,1298 Coates Avenue,,Holbrook,New York,11741,,,,,New York,,LLC,40.797548,-73.081553,"(40.797548, -73.081553)"
13240,"Paraclete Home Health Care, Llc",LHCSA,Licensed Home Care Services Agency,04/07/2014,50 Gerard Street,Suite 100b (Second Floor),Huntington,New York,11743,6314272132.0,6312046040.0,,51,Suffolk,7,Metropolitan Area Regional Office - Long Island,,,2002L001,"Paraclete Home Health Care, Llc",50 Gerard Street,Suite 100b (Second Floor),Huntington,New York,11743,,,Suite 100b (Second Floor),,New York,,LLC,40.87218,-73.428564,"(40.87218, -73.428564)"
13993,Middle Island Home Training,DTC-EC,Diagnostic and Treatment Center Extension Clinic,12/29/2020,1277 Middle Country Road,,Middle Island,New York,11953,,,,51,Suffolk,7,Metropolitan Area Regional Office - Long Island,Bronx Dialysis Center,6661.0,7000272R,"Knickerbocker Dialysis, Inc",1615-1617 Eastchester Road,,Bronx,New York,10461,,,,,New York,,Business Corporation,40.886364,-72.923117,"(40.886364, -72.923117)"
13280,Alvita Care,LHCSA,Licensed Home Care Services Agency,09/28/2015,1050 Motor Parkway,Suite 401,Hauppauge,New York,11788,2122730490.0,2122730499.0,,51,Suffolk,7,Metropolitan Area Regional Office - Long Island,,,2071L002,"Home Life Health Care, Llc",231 West 29th Street,Suite 400,New York,New York,10001,,,Suite 400,,New York,,LLC,40.801667,-73.218239,"(40.801667, -73.218239)"
14829,Rosewood on the Sound,AH,Adult Home,02/28/1983,59 Bayville Avenue,,Bayville,New York,11709,5166281350.0,5166282839.0,#http://rosewoodonthesound.com/#,29,Nassau,7,Metropolitan Area Regional Office - Long Island,,,400-F-333,"Rosewood on the Sound, LLC",59 Bayville Avenue,,Bayville,New York,11709-1654,,,,,New York,,LLC,40.911091,-73.573752,"(40.911091, -73.573752)"
3230,The Hamlet Rehabilitation and Healthcare Center at Nesconset,NH,Residential Health Care Facility - SNF,02/01/1989,100 Southern Boulevard,,Nesconset,New York,11767,6313618800.0,6313619528.0,,51,Suffolk,7,Metropolitan Area Regional Office - Long Island,,,5157320N,Nesconset Operating LLC,100 Southern Boulevard,,Nesconset,New York,11767,,,,,New York,,LLC,40.84948,-73.158676,"(40.84948, -73.158676)"
949,Brookside Multicare Nursing Center,NH,Residential Health Care Facility - SNF,08/01/1980,7 Route 25A,,Smithtown,New York,11787,6317242200.0,6317240062.0,,51,Suffolk,7,Metropolitan Area Regional Office - Long Island,,,5157318N,"Optima Care Smithtown, LLC",7 Route 25A,,Smithtown,New York,11787,,,,,New York,,LLC,40.859619,-73.213394,"(40.859619, -73.213394)"
15388,Stony Brook University School of Dental Medicine School Base Community Mobile Program,,School Based Diagnostic and Treatment Center Extension Clinic,05/27/2009,Nicholls Road,,Stony Brook,New York,11794,,,,51,Suffolk,7,Metropolitan Area Regional Office - Long Island,SUNY at Stony Brook School of Dental Medicine Dental Care Center,905.0,5151201R,SUNY at Stony Brook,178-50 Linden Blvd,,Jamaica,New York,11434,,,,,New York,,State,,,
4089,Northwell Health Stern Family Center for Rehabilitation,NH,Residential Health Care Facility - SNF,04/01/1989,330 Community Drive,,Manhasset,New York,11030,5165628000.0,5165628074.0,,29,Nassau,7,Metropolitan Area Regional Office - Long Island,,,2951305N,Northwell Health Stern Family Center for Rehabilitation,300 Community Drive,,Manhasset,New York,11030,"Northwell Healthcare, Inc.",2000 Marcus Ave.,,New Hyde Park,New York,11042.0,Not for Profit Corporation,40.773783,-73.699986,"(40.773783, -73.699986)"
6314,NYU Langone Hospital-Long Island Diagnostic Center,HOSP-EC,Hospital Extension Clinic,09/11/2001,222 Station Plaza North,,Mineola,New York,11501,5166632300.0,,,29,Nassau,7,Metropolitan Area Regional Office - Long Island,NYU Langone Hospitals,1463.0,7002053H,NYU Langone Hospitals,550 First Avenue,,New York,New York,10016,,,,,New York,,Not for Profit Corporation,40.740757,-73.640533,"(40.740757, -73.640533)"
6480,Digestive Health Center of Huntington,DTC,Diagnostic and Treatment Center,12/23/2002,195 East Main Street,,Huntington,New York,11743,6313858677.0,,,51,Suffolk,7,Metropolitan Area Regional Office - Long Island,,,5153212R,"DHCH, LLC","195 East Main Street, Suite A",,Huntington,New York,11743,,,,,New York,,LLC,40.881016,-73.397766,"(40.881016, -73.397766)"
3442,Quannacut Outpatient Services,HOSP-EC,Hospital Extension Clinic,01/31/1992,905 East Main Street,,Riverhead,New York,11901,6313698966.0,,,51,Suffolk,7,Metropolitan Area Regional Office - Long Island,Stony Brook University Hospital,245.0,5151001H,State University of New York,178-50 Linden Blvd,,Jamaica,New York,11434,,,,,New York,,State,40.92923,-72.679947,"(40.92923, -72.679947)"
888,Swan Lake Nursing & Rehabilitation,NH,Residential Health Care Facility - SNF,02/01/1979,25 Schoenfeld Blvd,,Patchogue,New York,11772,6312897700.0,,,51,Suffolk,7,Metropolitan Area Regional Office - Long Island,,,5123306N,"J & H Operations, LLC",25 Schoenfeld Blvd,,Patchogue,New York,11772,,,,,New York,,LLC,40.768742,-72.995651,"(40.768742, -72.995651)"
7882,Stony Brook Southampton Hospital Regional Dialysis,HOSP-EC,Hospital Extension Clinic,02/25/2000,184 West Montauk Highway,,Hampton Bays,New York,11946,6317234213.0,,,51,Suffolk,7,Metropolitan Area Regional Office - Long Island,Stony Brook University Hospital,245.0,5151001H,State University of New York,178-50 Linden Blvd,,Jamaica,New York,11434,,,,,New York,,State,40.874008,-72.537254,"(40.874008, -72.537254)"
12935,Preferred Home Care Of New York/Preferred Gold,LHCSA,Licensed Home Care Services Agency,02/05/2013,1 South Ocean Avenue,"Suites 212, 214 & 215",Patchogue,New York,11772,6316540789.0,6316540857.0,www.preferredhcny.com,51,Suffolk,7,Metropolitan Area Regional Office - Long Island,,,1519L002,Assistcare Home Health Services Llc,2357 60th Street,,Brooklyn,New York,11204,,,,,New York,,LLC,40.765636,-73.015032,"(40.765636, -73.015032)"
2832,North County Complex Methadone Maintenance Treatment Program,DTC-EC,Diagnostic and Treatment Center Extension Clinic,06/22/1982,151 N County Complex,,Hauppauge,New York,11788,5168540800.0,,,51,Suffolk,7,Metropolitan Area Regional Office - Long Island,Suffolk County Department of Health Clinic Services - Hauppauge Methadone,2951.0,5155200R,Suffolk County Department of Health,225 Rabro Drive East,,Hauppauge,New York,11788,,,,,New York,,County,40.826127,-73.232344,"(40.826127, -73.232344)"
13527,Brookside Home Care Inc.,LHCSA,Licensed Home Care Services Agency,11/29/2016,375 Sunrise Highway,Suite 10,Lynbrook,New York,11563,5165935969.0,5165848418.0,,29,Nassau,7,Metropolitan Area Regional Office - Long Island,,,2493L001,Brookside Home Care Inc.,375 Sunrise Highway,Suite 10,Lynbrook,New York,11563,,,Suite 10,,New York,,Business Corporation,40.654613,-73.672129,"(40.654613, -73.672129)"
14812,Island Assisted Living,AH,Adult Home,04/04/2014,820 Front Street,,Hempstead,New York,11550,5165641100.0,5165645353.0,,29,Nassau,7,Metropolitan Area Regional Office - Long Island,,,400-E-295,Newco Alp Inc.,820 Front Street,,Hempstead,New York,11550,,,,,New York,,Not for Profit Corporation,,,
12853,All You Need Homecare Agency,LHCSA,Licensed Home Care Services Agency,12/07/2007,2425 Grand Avenue,Suite 204,Baldwin,New York,11510-3219,5167714414.0,5167712541.0,,29,Nassau,7,Metropolitan Area Regional Office - Long Island,,,1331L001,"Mmagliore, Inc.",2425 Grand Avenue,Suite 204,Baldwin,New York,11510-3219,,,Suite 204,,New York,,Business Corporation,40.651149,-73.611813,"(40.651149, -73.611813)"
9112,NSUH Comprehensive Wound Care Center and Vascular Access Program,HOSP-EC,Hospital Extension Clinic,10/19/2010,1999 Marcus Avenue,,Lake Success,New York,11042,5162333780.0,,,29,Nassau,7,Metropolitan Area Regional Office - Long Island,North Shore University Hospital,541.0,2951001H,North Shore University Hospital Inc,300 Community Drive,,Manhasset,New York,11030,"Northwell Healthcare, Inc.",2000 Marcus Ave.,,New Hyde Park,New York,11042.0,Not for Profit Corporation,40.758892,-73.699997,"(40.758892, -73.699997)"
5630,North Shore Home Care,CHHA,Certified Home Health Agency,04/06/1995,972 Brush Hollow Road,,Westbury,New York,11590,5168765300.0,5168765284.0,,29,Nassau,7,Metropolitan Area Regional Office - Long Island,,,2914601,North Shore University Hospital Inc,300 Community Drive,,Manhasset,New York,11030,"Northwell Healthcare, Inc.",2000 Marcus Ave.,,New Hyde Park,New York,11042.0,Not for Profit Corporation,40.773228,-73.562088,"(40.773228, -73.562088)"
13529,"Pentec Infusions Of New York, Llc",LHCSA,Licensed Home Care Services Agency,07/31/2019,100 Duffy Avenue,Suite 510,Hicksville,New York,11801,5165953110.0,4844802252.0,,29,Nassau,7,Metropolitan Area Regional Office - Long Island,,,2495L001,"Pentec Infusions Of New York, Llc",100 Duffy Avenue,Suite 510,Hicksville,New York,11801,,,Suite 510,,New York,,LLC,40.766679,-73.52779,"(40.766679, -73.52779)"
4140,ProHEALTH Day Op Ambulatory Surgery Center,DTC,Diagnostic and Treatment Center,07/17/1989,225 Froehlich Farm Boulevard,,Woodbury,New York,11797,5162940030.0,,,29,Nassau,7,Metropolitan Area Regional Office - Long Island,,,2908202R,Day-Op Center of Long Island Inc,110 Willis Avenue,,Mineola,New York,11501,,,,,New York,,Business Corporation,,,
15051,Braemar Living at Medford,AH,Adult Home,12/21/2007,1529 North Ocean Avenue,,Medford,New York,11763,6312890600.0,6316820622.0,,51,Suffolk,7,Metropolitan Area Regional Office - Long Island,,,700-F-921,Medford Hamlet Llc,1529 North Ocean Avenue,,Medford,New York,11763,,,,,New York,,LLC,40.810298,-73.018042,"(40.810298, -73.018042)"
10006,South Shore University Hospital Endoscopy and Pain Management Center,HOSP-EC,Hospital Extension Clinic,01/18/2017,39 Brentwood Road,,Bay Shore,New York,11706,,,,51,Suffolk,7,Metropolitan Area Regional Office - Long Island,South Shore University Hospital,924.0,5154000H,South Shore University Hospital,301 East Main Street,,Bay Shore,New York,11706,"Northwell Healthcare, Inc.",2000 Marcus Ave.,,New Hyde Park,New York,11042.0,Not for Profit Corporation,40.728927,-73.234518,"(40.728927, -73.234518)"
12815,"European Expert Care Agency Ii, Inc.",LHCSA,Licensed Home Care Services Agency,10/26/2007,1927 New York Avenue,,Huntington Station,New York,11746-2909,6312713030.0,6312712007.0,,51,Suffolk,7,Metropolitan Area Regional Office - Long Island,,,1225L001,"European Expert Care Agency Ii, Inc.",1927 New York Avenue,,Huntington Station,New York,11746-2909,,,,,New York,,Business Corporation,40.835333,-73.411969,"(40.835333, -73.411969)"
6068,Hempstead High School,HOSP-SB,School Based Hospital Extension Clinic,09/12/1996,201 President Street,,Hempstead,New York,11550,,,,29,Nassau,7,Metropolitan Area Regional Office - Long Island,NYU Langone Hospitals,1463.0,7002053H,NYU Langone Hospitals,550 First Avenue,,New York,New York,10016,,,,,New York,,Not for Profit Corporation,40.69907,-73.63105,"(40.69907, -73.63105)"
13333,"Privatus Care Solutions, Inc.",LHCSA,Licensed Home Care Services Agency,06/21/2016,1325 Franklin Avenue,Suite 375,Garden City,New York,11530,5162532920.0,5167392501.0,,29,Nassau,7,Metropolitan Area Regional Office - Long Island,,,2142L002,"Privatus Care Solutions, Inc.",767 Third Avenue,Suite 3202,New York,New York,10017,,,Suite 3202,,New York,,Business Corporation,40.734924,-73.637592,"(40.734924, -73.637592)"
15451,Advanced Specialty Care Center at Lake Grove,HOSP-EC,Hospital Extension Clinic,05/18/2023,4 Smith Haven Mall,,Lake Grove,New York,11755,6314441362.0,,,51,Suffolk,7,Metropolitan Area Regional Office - Long Island,Stony Brook University Hospital,245.0,5151001H,State University of New York,178-50 Linden Blvd,,Jamaica,New York,11434,,,,,New York,,State,,,
13998,Mineola Dialysis Center,DTC-EC,Diagnostic and Treatment Center Extension Clinic,09/09/2020,1 East Jericho Turnpike,,Mineola,New York,11501,,,,29,Nassau,7,Metropolitan Area Regional Office - Long Island,Freedom Center of Syosset,9920.0,2952203R,"Freedom Center of Syosset, LLC",760 Broadway,,Hicksville,New York,11801,,,,,New York,,LLC,40.751255,-73.634471,"(40.751255, -73.634471)"
