13997,Long Beach Home Care,LHCSA,Licensed Home Care Services Agency,05/03/2021,375 East Bay Drive,,Long Beach,New York,11561,5168971200.0,5167657650.0,,29,Nassau,7,Metropolitan Area Regional Office - Long Island,,,2747L001,"MLAP Acquisition III, LLC",225 Crossways Park Drive,,Woodbury,New York,11797,,,,,New York,,LLC,40.594462,-73.654007,"(40.594462, -73.654007)"
537,Oceanside Care Center Inc,NH,Residential Health Care Facility - SNF,04/28/1991,2914 Lincoln Avenue,,Oceanside,New York,11572,5165362300.0,5167632531.0,,29,Nassau,7,Metropolitan Area Regional Office - Long Island,,,2950314N,Oceanside Care Center Inc,2914 Lincoln Avenue,,Oceanside,New York,11572,,,,,New York,,Business Corporation,40.640358,-73.64209,"(40.640358, -73.64209)"
498,Long Beach Nursing and Rehabilitation Center,NH,Residential Health Care Facility - SNF,01/01/1901,375 East Bay Drive,,Long Beach,New York,11561,5168971110.0,5168971224.0,,29,Nassau,7,Metropolitan Area Regional Office - Long Island,,,2902307N,"MLAP Acquisition I, LLC",375 East Bay Drive,,Long Beach,New York,11561,,,,,New York,,LLC,40.594276,-73.653496,"(40.594276, -73.653496)"
13244,Home Instead Senior Care,LHCSA,Licensed Home Care Services Agency,12/19/2014,19 Merrick Avenue,Suite 201,Merrick,New York,11566,5168266307.0,5168266346.0,,29,Nassau,7,Metropolitan Area Regional Office - Long Island,,,2009L001,"Zlc Senior Care, Inc.",19 Merrick Avenue,Suite 201,Merrick,New York,11566,,,Suite 201,,New York,,Business Corporation,40.664097,-73.552421,"(40.664097, -73.552421)"
4967,Middle Island Adult Day Health Services West,ADHCP,Adult Day Health Care Program - Offsite,02/11/2008,575 Clayton Street,,Central Islip,New York,11722,5162340550.0,,,51,Suffolk,7,Metropolitan Area Regional Office - Long Island,The Hamlet Rehabilitation and Healthcare Center at Nesconset,3230.0,5157320N,Nesconset Operating LLC,100 Southern Boulevard,,Nesconset,New York,11767,,,,,New York,,LLC,40.787064,-73.192581,"(40.787064, -73.192581)"
13277,Family Ped. H.C. Div. Of Tri-Borough H.C. Ltd.,LHCSA,Licensed Home Care Services Agency,05/01/2013,50 Clinton Street,Suite 600,Hempstead,New York,11550,5169330485.0,5162808557.0,www.triboroughhomecare.com,29,Nassau,7,Metropolitan Area Regional Office - Long Island,,,2069L002,"Tri-Borough Home Care, Ltd.",1414 Utica Avenue,,Brooklyn,New York,11203,,,,,New York,,Business Corporation,40.708214,-73.618389,"(40.708214, -73.618389)"
7572,Hampton Bays Extension Clinic,HOSP-EC,Hospital Extension Clinic,01/21/1998,225 West Montauk Highway,,Hampton Bays,New York,11946,,,,51,Suffolk,7,Metropolitan Area Regional Office - Long Island,Stony Brook University Hospital,245.0,5151001H,State University of New York,178-50 Linden Blvd,,Jamaica,New York,11434,,,,,New York,,State,40.866936,-72.547874,"(40.866936, -72.547874)"
14833,Village Green A Carlisle Assisted Living Community,AH,Adult Home,10/16/2020,90 Schoolhouse Road,,Levittown,New York,11756,5162712500.0,5162034307.0,#https://villagegreenseniorliving.com#,29,Nassau,7,Metropolitan Area Regional Office - Long Island,,,400-F-341,"D & F Levittown, A.L., LLC",90 Schoolhouse Road,,Levittown,New York,11756,,,,,New York,,LLC,40.729022,-73.531806,"(40.729022, -73.531806)"
4211,Early Childhood Intervention Program,HOSP-EC,Hospital Extension Clinic,10/06/1989,1983 Marcus Avenue,,Lake Success,New York,11042,7184707621.0,,,29,Nassau,7,Metropolitan Area Regional Office - Long Island,Long Island Jewish Medical Center,1630.0,7003004H,Long Island Jewish Medical Center,270-05 76 Avenue,,New Hyde Park,New York,11040,"Northwell Healthcare, Inc.",2000 Marcus Ave.,,New Hyde Park,New York,11042.0,Not for Profit Corporation,40.758907,-73.700081,"(40.758907, -73.700081)"
13368,Safecare Home Care Agency Inc.,LHCSA,Licensed Home Care Services Agency,09/06/2017,1621 A Hillside Avenue,,New Hyde Park,New York,11040,5162332266.0,8669496682.0,,29,Nassau,7,Metropolitan Area Regional Office - Long Island,,,2201L001,Safecare Home Care Agency Inc.,1621 A Hillside Avenue,,New Hyde Park,New York,11040,,,,,New York,,Business Corporation,40.748651,-73.684953,"(40.748651, -73.684953)"
938,Peconic Bay Medical Center,HOSP,Hospital,01/01/1901,1 Heroes Way,,Riverhead,New York,11901,6315486000.0,,,51,Suffolk,7,Metropolitan Area Regional Office - Long Island,,,5155000H,Central Suffolk Hospital,1 Heroes Way,,Riverhead,New York,11901,"Northwell Healthcare, Inc.",2000 Marcus Ave.,,New Hyde Park,New York,11042.0,Not for Profit Corporation,40.9348,-72.6753,"(40.9348, -72.6753)"
9428,NSUH LIJ Imaging at Syosset,HOSP-EC,Hospital Extension Clinic,02/04/2013,100 Lafayette Drive,,Syosset,New York,11797,5166223456.0,5166223450.0,,29,Nassau,7,Metropolitan Area Regional Office - Long Island,North Shore University Hospital,541.0,2951001H,North Shore University Hospital Inc,300 Community Drive,,Manhasset,New York,11030,"Northwell Healthcare, Inc.",2000 Marcus Ave.,,New Hyde Park,New York,11042.0,Not for Profit Corporation,40.811646,-73.509987,"(40.811646, -73.509987)"
3545,Planned Parenthood Hudson Peconic - West Islip,DTC-EC,Diagnostic and Treatment Center Extension Clinic,01/26/1998,180 Sunrise Highway,,West Islip,New York,11795,5168930150.0,,,51,Suffolk,7,Metropolitan Area Regional Office - Long Island,"Planned Parenthood Hudson Peconic, Inc",1049.0,5902208R,"Planned Parenthood Hudson Peconic, Inc.",570 Taxter Road,Suite 250,Elmsford,New York,10523,,,Suite 250,,New York,,Not for Profit Corporation,40.719131,-73.305229,"(40.719131, -73.305229)"
6636,Memorial Sloan Kettering Commack,HOSP-EC,Hospital Extension Clinic,06/03/2002,650 Commack Road,,Commack,New York,11725,6316234000.0,,,51,Suffolk,7,Metropolitan Area Regional Office - Long Island,Memorial Hospital for Cancer and Allied Diseases,1453.0,7002020H,Memorial Hospital for Cancer and Allied Diseases Inc,1275 York Avenue,,New York,New York,10021,,,,,New York,,Not for Profit Corporation,40.811531,-73.294006,"(40.811531, -73.294006)"
10410,St. Charles Rehabilitation - West Babylon,HOSP-EC,Hospital Extension Clinic,01/10/2020,501A Montauk Highway,,West Babylon,New York,11704,6314745606.0,,,51,Suffolk,7,Metropolitan Area Regional Office - Long Island,St. Charles Hospital,896.0,5149001H,"Catholic Health System of Long Island, Inc.",1 Huntington Quadrangle,,Melville,New York,11747,St Charles Hosp and Rehab Ctr Inc,200 Bell Terre Road,,Port Jefferson,New York,11777.0,Not for Profit Corporation,40.688939,-73.339745,"(40.688939, -73.339745)"
877,Berkshire Nursing & Rehabilitation  Center,NH,Residential Health Care Facility - SNF,02/01/1980,10 Berkshire Road,,W Babylon,New York,11704,6315870600.0,6315870053.0,,51,Suffolk,7,Metropolitan Area Regional Office - Long Island,,,5101301N,Berkshire Nursing Home LLC,10 Berkshire Rd,,West Babylon,New York,11704,,,,,New York,,LLC,40.706352,-73.343933,"(40.706352, -73.343933)"
15079,The Bristal at West Babylon,EHP,Enriched Housing Program,10/18/2017,520 Montauk Highway (Unit A),,West Babylon,New York,11704,6316355501.0,6315399860.0,#https://thebristal.com/west-babylon#,51,Suffolk,7,Metropolitan Area Regional Office - Long Island,,,700-S-313,EB Care at West Babylon LLC,67 Clinton Rd,,Garden City,New York,11530,,,,,New York,,LLC,40.68791,-73.340597,"(40.68791, -73.340597)"
14811,The Regency at Glen Cove,AH,Adult Home,06/22/1993,94 School Street,,Glen Cove,New York,11542,5166743007.0,5166744144.0,www.theregencyatglencove.com#http://www.theregencyatglencove.com#,29,Nassau,7,Metropolitan Area Regional Office - Long Island,,,400-E-290,"National Healthplex, Inc.",94 School St,,Glen Cove,New York,11542-2513,,,,,New York,,Not for Profit Corporation,40.867175,-73.630248,"(40.867175, -73.630248)"
10006,South Shore University Hospital Endoscopy and Pain Management Center,HOSP-EC,Hospital Extension Clinic,01/18/2017,39 Brentwood Road,,Bay Shore,New York,11706,,,,51,Suffolk,7,Metropolitan Area Regional Office - Long Island,South Shore University Hospital,924.0,5154000H,South Shore University Hospital,301 East Main Street,,Bay Shore,New York,11706,"Northwell Quality and Medical Affairs, Inc.",2000 Marcus Ave.,,New Hyde Park,New York,11042.0,Not for Profit Corporation,40.728927,-73.234518,"(40.728927, -73.234518)"
12967,"Alliance Homecare, Inc.",LHCSA,Licensed Home Care Services Agency,07/29/2009,100 Cross Ways Park Drive West,Suite 217,Woodbury,New York,11797,8776877380.0,8452150135.0,,29,Nassau,7,Metropolitan Area Regional Office - Long Island,,,1570L001,"Alliance Homecare, Inc.",100 Cross Ways Park Drive West,Suite 217,Woodbury,New York,11797,,,Suite 217,,New York,,Business Corporation,40.807681,-73.489595,"(40.807681, -73.489595)"
15450,Igbans Home Care Services INC,LHCSA,Licensed Home Care Services Agency,11/11/2022,609 Route 109 Suite 2B2,,West Babylon,New York,11704,6318858002.0,6318858004.0,,51,Suffolk,7,Metropolitan Area Regional Office - Long Island,,,2092L002,"Igbans Home Care Services, Inc.",218-34 139th Avenue,,Springfield Gardens,New York,11413,,,,,New York,,Not for Profit Corporation,,,
9632,John T. Mather Memorial Hospital Outpatient Rehabilitation,HOSP-EC,Hospital Extension Clinic,02/07/2014,125 Oakland Avenue,,Port Jefferson,New York,11777,6314762737.0,6316862543.0,,51,Suffolk,7,Metropolitan Area Regional Office - Long Island,John T Mather Memorial Hospital of Port Jefferson New York Inc,895.0,5149000H,John T Mather of Port Jefferson NY Inc,North Country Road,,Port Jefferson,New York,11777,"Northwell Healthcare, Inc.",2000 Marcus Ave.,,New Hyde Park,New York,11042.0,Not for Profit Corporation,40.936291,-73.053978,"(40.936291, -73.053978)"
15506,Mount Sinai South Nassau - Vaxmobile,,Mobile Hospital Extension Clinic,06/06/2023,One Healthy Way,,Oceanside,New York,11572,5166323999.0,,,29,Nassau,7,Metropolitan Area Regional Office - Long Island,Mount Sinai South Nassau,527.0,2950001H,South Nassau Communities Hospital Inc,2445 Oceanside Road,,Oceanside,New York,11572,"Mount Sinai Hospitals Group, Inc.",One Gustave L. Levy Place,,New York,New York,10029.0,Not for Profit Corporation,,,
7619,Long Island Community Hospital Dialysis Center,HOSP-EC,Hospital Extension Clinic,07/17/1998,109 West Main Street,,Patchogue,New York,11772,,,,51,Suffolk,7,Metropolitan Area Regional Office - Long Island,Long Island Community Hospital,885.0,5123000H,Long Island Community Hospital at NYU Langone Health,101 Hospital Road,,Patchogue,New York,11772,NYU Langone Health System,550 First Avenue,,New York,New York,10016.0,Not for Profit Corporation,40.765919,-73.017853,"(40.765919, -73.017853)"
7524,NYU Langone Hospital-Long Island Dialysis Center at Bethpage,HOSP-EC,Hospital Extension Clinic,02/12/1998,530 Hicksville Road,,Bethpage,New York,11714,,,,29,Nassau,7,Metropolitan Area Regional Office - Long Island,NYU Langone Hospitals,1463.0,7002053H,NYU Langone Hospitals,550 First Avenue,,New York,New York,10016,,,,,New York,,Not for Profit Corporation,40.738598,-73.494942,"(40.738598, -73.494942)"
13517,"Bayshore Home Healthcare, Inc.",LHCSA,Licensed Home Care Services Agency,07/16/2015,55 East Main Street,,Bayshore,New York,11706,6316479020.0,6316479021.0,,51,Suffolk,7,Metropolitan Area Regional Office - Long Island,,,2473L001,"Bayshore Home Healthcare, Inc.",55 East Main Street,,Bayshore,New York,11706,,,,,New York,,Business Corporation,40.722699,-73.246624,"(40.722699, -73.246624)"
9172,North Shore LIJ Imaging at Great South Bay,HOSP-EC,Hospital Extension Clinic,10/21/2010,620 Main Street,,Islip,New York,11751,6314397237.0,6314397290.0,,51,Suffolk,7,Metropolitan Area Regional Office - Long Island,North Shore University Hospital,541.0,2951001H,North Shore University Hospital Inc,300 Community Drive,,Manhasset,New York,11030,"Northwell Healthcare, Inc.",2000 Marcus Ave.,,New Hyde Park,New York,11042.0,Not for Profit Corporation,40.729557,-73.211349,"(40.729557, -73.211349)"
13039,"Xincon Home-Healthcare Services, Inc.",LHCSA,Licensed Home Care Services Agency,10/08/2014,445 Broad Hollow Road,Suite 25,Melville,New York,11747,6318810821.0,6318810818.0,,51,Suffolk,7,Metropolitan Area Regional Office - Long Island,,,1669L002,"Xincon Home-Healthcare Services, Inc.",20 West 33rd Street,Unit 2006A,New York,New York,10001,,,Unit 2006A,,New York,,Business Corporation,40.775446,-73.418379,"(40.775446, -73.418379)"
6366,Advanced Pediatric and Specialty Care at East Islip,HOSP-EC,Hospital Extension Clinic,04/26/2002,269 East Main Street,,East Islip,New York,11730,6314443094.0,,,51,Suffolk,7,Metropolitan Area Regional Office - Long Island,Stony Brook University Hospital,245.0,5151001H,State University of New York,178-50 Linden Blvd,,Jamaica,New York,11434,,,,,New York,,State,,,
15047,The Arbors at Islandia East,AH,Adult Home,11/15/1995,1515A Veterans Memorial Highway,,Islandia,New York,11749,6312323131.0,6313421855.0,www.seniorcareassistedliving.com#http://www.seniorcareassistedliving.com#,51,Suffolk,7,Metropolitan Area Regional Office - Long Island,,,700-F-914,"Arcadia Management, Inc.",1515 Veterans Memorial Highway,,Islandia,New York,11749-4848,,,,,New York,,Business Corporation,40.810876,-73.185199,"(40.810876, -73.185199)"
527,Mount Sinai South Nassau,HOSP,Hospital,01/01/1901,One Healthy Way,,Oceanside,New York,11572,5166323000.0,,,29,Nassau,7,Metropolitan Area Regional Office - Long Island,,,2950001H,South Nassau Communities Hospital Inc,2445 Oceanside Road,,Oceanside,New York,11572,"Mount Sinai Hospitals Group, Inc.",One Gustave L. Levy Place,,New York,New York,10029.0,Not for Profit Corporation,40.649601,-73.6315,"(40.649601, -73.6315)"
10386,Stony Brook Medicine Mobile Mammography,,Mobile Hospital Extension Clinic,10/05/2018,2000 Ocean Avenue,,Ronkonkoma,New York,11779,6316380657.0,6316380623.0,,51,Suffolk,7,Metropolitan Area Regional Office - Long Island,Stony Brook University Hospital,245.0,5151001H,State University of New York,178-50 Linden Blvd,,Jamaica,New York,11434,,,,,New York,,State,40.793195,-73.122719,"(40.793195, -73.122719)"
15247,Esplanade of Woodmere,AH,Adult Home,12/14/2021,130 Irving Place,,Woodmere,New York,11598,5166651645.0,5168940800.0,meridiansenior.com/senior-living/woodmere/esplanade-of-woodmere,29,Nassau,7,Metropolitan Area Regional Office - Long Island,,,400-F-345,Woodmere Operating Company LLC,130 Irving Place,,Woodmere,New York,11598,,,,,New York,,LLC,,,
3041,Good Samaritan Nursing and Rehabilitation Care Center,NH,Residential Health Care Facility - SNF,01/17/1980,101 Elm Street,,Sayville,New York,11782,6312442400.0,6312442405.0,,51,Suffolk,7,Metropolitan Area Regional Office - Long Island,,,5154310N,Good Samaritan Hospital Medical Center,1000 Montauk Highway,,West Islip,New York,11795,"Catholic Health System of Long Island, Inc.",1 Huntington Quadrangle,,Melville,New York,11747.0,Not for Profit Corporation,40.725567,-73.079498,"(40.725567, -73.079498)"
4935,Planned Parenthood Hudson Peconic - Smithtown,DTC-EC,Diagnostic and Treatment Center Extension Clinic,01/26/1998,70 Maple Avenue,,Smithtown,New York,11787,5163617526.0,,,51,Suffolk,7,Metropolitan Area Regional Office - Long Island,"Planned Parenthood Hudson Peconic, Inc",1049.0,5902208R,"Planned Parenthood Hudson Peconic, Inc.",570 Taxter Road,Suite 250,Elmsford,New York,10523,,,Suite 250,,New York,,Not for Profit Corporation,40.852985,-73.197395,"(40.852985, -73.197395)"
5629,Catholic Home Care,CHHA,Certified Home Health Agency,07/01/1979,"110 Bi-County Boulevard, Suite 114",,Farmingdale,New York,11735,6318287400.0,6318287475.0,,29,Nassau,7,Metropolitan Area Regional Office - Long Island,,,2914600,"Nursing Sisters Home Care, Inc.",110 Bi-County Boulevard,Suite 114,Farmingdale,New York,11735,,,Suite 114,,New York,,Not for Profit Corporation,40.725994,-73.428329,"(40.725994, -73.428329)"
13799,"Able Health Care Service, Inc.-Lhcsa",LHCSA,Licensed Home Care Services Agency,12/03/1992,1747-16  Veterans Hwy,Ste 16,Islandia,New York,11749-1534,6319520500.0,6319528795.0,,51,Suffolk,7,Metropolitan Area Regional Office - Long Island,,,9315L002,"Able Health Care Service, Inc.-Lhcsa",91-31 Queens Blvd.,,Elmhurst,New York,11373,,,,,New York,,Business Corporation,40.806623,-73.180078,"(40.806623, -73.180078)"
12823,Critical Health Care Registered Nursing Services P.C.,LHCSA,Licensed Home Care Services Agency,08/16/2005,251 Oakland Avenue,Suite 1B,Port Jefferson,New York,11777,6314734036.0,6314734214.0,,51,Suffolk,7,Metropolitan Area Regional Office - Long Island,,,1259L001,Critical Health Care Registered Nursing Services P.C.,251 Oakland Avenue,Suite 1B,Port Jefferson,New York,11777,,,Suite 1B,,New York,,Business Corporation,,,
6201,West Nassau Dialysis Center Inc,DTC,Diagnostic and Treatment Center,10/13/2000,75 Rockaway Ave,,Valley Stream,New York,11580,5168234444.0,,,29,Nassau,7,Metropolitan Area Regional Office - Long Island,,,2910200R,West Nassau Dialysis Center Inc,75 Rockaway Ave,,Valley Stream,New York,11580,,,,,New York,,Business Corporation,40.663586,-73.698486,"(40.663586, -73.698486)"
13696,Right At Home,LHCSA,Licensed Home Care Services Agency,09/24/2019,752a Hempstead Turnpike,Suite 201,Franklin Square,New York,11010,5163078070.0,5163078060.0,,29,Nassau,7,Metropolitan Area Regional Office - Long Island,,,2725L001,K. Campion Inc.,752a Hempstead Turnpike,Suite 201,Franklin Square,New York,11010,,,Suite 201,,New York,,Business Corporation,40.707052,-73.667746,"(40.707052, -73.667746)"
13338,7 Day Home Care Ltd.,LHCSA,Licensed Home Care Services Agency,03/03/2016,1979 Marcus Avenue,Suite E102,Lake Success,New York,11042,5166222330.0,5166222201.0,,29,Nassau,7,Metropolitan Area Regional Office - Long Island,,,2151L001,7 Day Home Care Ltd.,1979 Marcus Avenue,Suite E102,Lake Success,New York,11042,,,Suite E102,,New York,,Business Corporation,40.754834,-73.693126,"(40.754834, -73.693126)"
15065,Amber Court  of Smithtown,AH,Adult Home,01/09/2018,130-132 Lake Avenue,,Nesconset,New York,11767,6317681000.0,6316568822.0,www.AmberCourtAL.com#http://www.AmberCourtAL.com#,51,Suffolk,7,Metropolitan Area Regional Office - Long Island,,,700-F-945,Amber Court @ Suffolk County LLC,130 Lake Avenue S,,Nesconset,New York,11767,,,,,New York,,LLC,40.854293,-73.154714,"(40.854293, -73.154714)"
13001,Blessed Healthcare And Staffing Agency,LHCSA,Licensed Home Care Services Agency,05/20/2016,1149 Old Country Road,Suite B3,Riverhead,New York,11901,6315912727.0,6315912728.0,,51,Suffolk,7,Metropolitan Area Regional Office - Long Island,,,1621L002,Blessed Healthcare And Staffing Agency,692 South Wellwood Avenue,,Lindenhurst,New York,11757,,,,,New York,,Partnership,40.930333,-72.677914,"(40.930333, -72.677914)"
520,Lynbrook Restorative Therapy and Nursing,NH,Residential Health Care Facility - SNF,02/01/1980,243 Atlantic Avenue,,Lynbrook,New York,11563,5165992744.0,5165993871.0,,29,Nassau,7,Metropolitan Area Regional Office - Long Island,,,2911303N,"East Rockaway Center, LLC",243 Atlantic Avenue,,Lynbrook,New York,11563-3552,,,,,New York,,LLC,40.649876,-73.667297,"(40.649876, -73.667297)"
13086,The Eliot At Erie Station,LHCSA,Licensed Home Care Services Agency,02/07/2014,301 8th Avenue,,East Northport,New York,11731,6313068140.0,,,51,Suffolk,7,Metropolitan Area Regional Office - Long Island,,,1751L002,"The Eliot Management Group, Llc",12 John Street,,Middletown,New York,10940,,,,,New York,,LLC,40.87689,-73.329264,"(40.87689, -73.329264)"
13498,Good Shepherd Personal Care Inc,LHCSA,Licensed Home Care Services Agency,01/29/2020,6 Tuxedo Avenue,,New Hyde Park,New York,11040,5168530606.0,5165888118.0,,29,Nassau,7,Metropolitan Area Regional Office - Long Island,,,2440L001,Good Shepherd Personal Care Inc,6 Tuxedo Avenue,,New Hyde Park,New York,11040,,,,,New York,,Business Corporation,40.750988,-73.672439,"(40.750988, -73.672439)"
6979,Long Island Community Hospital Wound Care & Hyperbaric Medicine,HOSP-EC,Hospital Extension Clinic,02/20/2006,33 Medford Avenue,,Patchogue,New York,11772,6316874195.0,,,51,Suffolk,7,Metropolitan Area Regional Office - Long Island,Long Island Community Hospital,885.0,5123000H,Long Island Community Hospital at NYU Langone Health,101 Hospital Road,,Patchogue,New York,11772,NYU Langone Health System,550 First Avenue,,New York,New York,10016.0,Not for Profit Corporation,40.767181,-73.006935,"(40.767181, -73.006935)"
10049,Fresenius Kidney Care - Lindenhurst,DTC-EC,Diagnostic and Treatment Center Extension Clinic,05/25/2017,185 South Tenth Street,,Lindenhurst,New York,11757,,,,51,Suffolk,7,Metropolitan Area Regional Office - Long Island,FMS-Southern Manhattan Dialysis Center,3414.0,7002176R,New York Dialysis Services Inc,650 Mcclellan,,Schenectady,New York,12304,,,,,New York,,Business Corporation,40.682709,-73.381792,"(40.682709, -73.381792)"
904,Sun River Health Shirley,DTC-EC,Diagnostic and Treatment Center Extension Clinic,06/22/1982,550 Montauk Highway,,Shirley,New York,11967,5168521000.0,,,51,Suffolk,7,Metropolitan Area Regional Office - Long Island,Sun River Health,1040.0,5901200R,"Sun River Health Care, Inc.",1037 Main Street,,Peekskill,New York,10566,,,,,New York,,Not for Profit Corporation,40.800552,-72.879204,"(40.800552, -72.879204)"
13418,"Angels Of Mercy Counseling Center, Inc.",LHCSA,Licensed Home Care Services Agency,11/22/2017,85 Schleigel Boulevard,,Amityville,New York,11701,6316081740.0,6316082989.0,,51,Suffolk,7,Metropolitan Area Regional Office - Long Island,,,2292L001,"Angels Of Mercy Counseling Center, Inc.",85 Schleigel Boulevard,,Amityville,New York,11701,,,,,New York,,Not for Profit Corporation,40.707138,-73.41035,"(40.707138, -73.41035)"
931,Sunrise Manor Center for Nursing and Rehabilitation,NH,Residential Health Care Facility - SNF,02/01/1989,1325 Brentwood Road,,Bay Shore,New York,11706,6316654960.0,6316659411.0,,51,Suffolk,7,Metropolitan Area Regional Office - Long Island,,,5154312N,"Sunrise Manor Nursing Home, Inc",1325 Brentwood Road,,Bay Shore,New York,11706,,,,,New York,,Business Corporation,40.740219,-73.239174,"(40.740219, -73.239174)"
3421,Long Island State Veterans Home,NH,Residential Health Care Facility - SNF,10/25/1991,SUNY At Stonybrook 100 Patriots Road,,Stonybrook,New York,11790,6314448606.0,6314448575.0,,51,Suffolk,7,Metropolitan Area Regional Office - Long Island,,,5151310N,Health Sciences Center,101 Nicolls Road,,Stony Brook,New York,11794,,,,,New York,,State,40.912102,-73.121696,"(40.912102, -73.121696)"
15033,Olsen Rest,AH,Adult Home,04/30/1985,P.O. Box 256,366 Gibbs Pond,Nesconset,New York,11767,6315885676.0,6315885676.0,,51,Suffolk,7,Metropolitan Area Regional Office - Long Island,,,700-F-223,"Olsen, George Jr.",366 Gibbs Pond Rd,,Nesconset,New York,11767-2102,,,,,New York,,Individual,40.8336,-73.1496,"(40.8336, -73.1496)"
15356,Brightview Port Jefferson,AH,Adult Home,09/30/2022,1175 Rt. 112,,Port Jefferson Station,New York,11776,6318025021.0,6318025022.0,https://www.brightviewseniorliving.com/find-a-community/brightview-port-jefferso,51,Suffolk,7,Metropolitan Area Regional Office - Long Island,,,700-F-965,"BV Port Jefferson Operator, LLC",218 N. Charles St.,Suite 220,Baltimore,New York,21201,,,Suite 220,,New York,,LLC,,,
13133,"Bethesda Elite Care, Inc.",LHCSA,Licensed Home Care Services Agency,06/13/2012,3 Surrey Lane,,Manorville,New York,11949,6315037209.0,6319092445.0,,51,Suffolk,7,Metropolitan Area Regional Office - Long Island,,,1827L001,"Bethesda Elite Care, Inc.",3 Surrey Lane,,Manorville,New York,11949,,,,,New York,,Business Corporation,40.848717,-72.791197,"(40.848717, -72.791197)"
15322,Harmony Health Care Long Island - Mobile Van,,Mobile Diagnostic and Treatment Center Extension Clinic,06/17/2022,135 Main Street,,Hempstead,New York,11550,5169967095.0,,,29,Nassau,7,Metropolitan Area Regional Office - Long Island,Harmony Health Care Long Island,15557.0,2908201R,Nassau Health Care Corporation,240 Old Country Road,,Mineola,New York,11501,Harmony Health Care Long Island,2201 Hempstead Turnpike,,East Meadow,New York,11554.0,Public Benefit Corporation,,,
15446,Lifeworx Care LLC,LHCSA,Licensed Home Care Services Agency,12/01/2020,550 Northern Blvd,,Great Neck,New York,11021,,,,29,Nassau,7,Metropolitan Area Regional Office - Long Island,,,2665L002,Lifeworx Care Llc,864 Lexington Avenue,,New York,New York,10065,,,,,New York,,LLC,,,
13932,VNS Health Personal Care,LHCSA,Licensed Home Care Services Agency,07/01/2004,375 North Broadway,Suite 201,Jericho,New York,11753,5169424596.0,5162942844.0,www.partnersincareny.org,29,Nassau,7,Metropolitan Area Regional Office - Long Island,,,9919L005,"New Partners, Inc.",220 East 42nd Street,2nd Floor,New York,New York,10017,,,2nd Floor,,New York,,Not for Profit Corporation,,,
12698,Rockaway Home Care,LHCSA,Licensed Home Care Services Agency,02/23/2013,260 Doughty Boulevard,,Inwood,New York,11096,5162398693.0,5162394199.0,,29,Nassau,7,Metropolitan Area Regional Office - Long Island,,,0956L002,Foundation For The Elderly,260 Doughty Boulevard,,Inwood,New York,11096,,,,,New York,,Not for Profit Corporation,40.618542,-73.746163,"(40.618542, -73.746163)"
12958,Serene Home Nursing Agency,LHCSA,Licensed Home Care Services Agency,07/31/2009,42 Academy Street,,Patchogue,New York,11772,6316969669.0,6314964966.0,,51,Suffolk,7,Metropolitan Area Regional Office - Long Island,,,1549L001,"Sarene Services, Inc.",42 Academy Street,,Patchogue,New York,11772,,,,,New York,,Business Corporation,40.763039,-73.011706,"(40.763039, -73.011706)"
6491,NYU Langone Perlmutter Cancer Center - Long Island Breast Imaging Center,HOSP-EC,Hospital Extension Clinic,01/13/2003,120 Mineola Boulevard,,Mineola,New York,11501,,,,29,Nassau,7,Metropolitan Area Regional Office - Long Island,NYU Langone Hospitals,1463.0,7002053H,NYU Langone Hospitals,550 First Avenue,,New York,New York,10016,,,,,New York,,Not for Profit Corporation,40.742096,-73.640411,"(40.742096, -73.640411)"
